{
  "documents": [
    {
      "id": "ai-readme",
      "path": "docs/ai/README.md",
      "title": "AI documentation guide",
      "urls": {
        "ai": "https://raw.githubusercontent.com/tooppoo/reportage/X.Y.Z/docs/ai/README.md",
        "human": "https://github.com/tooppoo/reportage/blob/X.Y.Z/docs/ai/README.md"
      }
    },
    {
      "id": "ai-quick-reference",
      "path": "docs/ai/quick-reference.md",
      "title": "AI quick reference",
      "urls": {
        "ai": "https://raw.githubusercontent.com/tooppoo/reportage/X.Y.Z/docs/ai/quick-reference.md",
        "human": "https://github.com/tooppoo/reportage/blob/X.Y.Z/docs/ai/quick-reference.md"
      }
    },
    {
      "id": "syntax",
      "path": "docs/reference/syntax.md",
      "title": "Syntax reference",
      "urls": {
        "ai": "https://raw.githubusercontent.com/tooppoo/reportage/X.Y.Z/docs/reference/syntax.md",
        "human": "https://github.com/tooppoo/reportage/blob/X.Y.Z/docs/reference/syntax.md"
      }
    },
    {
      "id": "syntax-conformance",
      "path": "docs/design/testing/syntax-conformance.md",
      "title": "Syntax conformance fixtures",
      "urls": {
        "ai": "https://raw.githubusercontent.com/tooppoo/reportage/X.Y.Z/docs/design/testing/syntax-conformance.md",
        "human": "https://github.com/tooppoo/reportage/blob/X.Y.Z/docs/design/testing/syntax-conformance.md"
      }
    },
    {
      "id": "semantics",
      "path": "docs/reference/semantics.md",
      "title": "Semantics",
      "urls": {
        "ai": "https://raw.githubusercontent.com/tooppoo/reportage/X.Y.Z/docs/reference/semantics.md",
        "human": "https://github.com/tooppoo/reportage/blob/X.Y.Z/docs/reference/semantics.md"
      }
    },
    {
      "id": "semantic-rules",
      "path": "docs/reference/semantic-rules.md",
      "title": "Semantic rule catalog",
      "urls": {
        "ai": "https://raw.githubusercontent.com/tooppoo/reportage/X.Y.Z/docs/reference/semantic-rules.md",
        "human": "https://github.com/tooppoo/reportage/blob/X.Y.Z/docs/reference/semantic-rules.md"
      }
    },
    {
      "id": "diagnostics",
      "path": "docs/reference/diagnostics.md",
      "title": "Diagnostics",
      "urls": {
        "ai": "https://raw.githubusercontent.com/tooppoo/reportage/X.Y.Z/docs/reference/diagnostics.md",
        "human": "https://github.com/tooppoo/reportage/blob/X.Y.Z/docs/reference/diagnostics.md"
      }
    },
    {
      "id": "semantic-diagnostics",
      "path": "docs/reference/semantic-diagnostics.md",
      "title": "Semantic and assertion diagnostics",
      "urls": {
        "ai": "https://raw.githubusercontent.com/tooppoo/reportage/X.Y.Z/docs/reference/semantic-diagnostics.md",
        "human": "https://github.com/tooppoo/reportage/blob/X.Y.Z/docs/reference/semantic-diagnostics.md"
      }
    },
    {
      "id": "execution-model",
      "path": "docs/reference/execution-model.md",
      "title": "Execution model",
      "urls": {
        "ai": "https://raw.githubusercontent.com/tooppoo/reportage/X.Y.Z/docs/reference/execution-model.md",
        "human": "https://github.com/tooppoo/reportage/blob/X.Y.Z/docs/reference/execution-model.md"
      }
    },
    {
      "id": "exit-codes",
      "path": "docs/reference/exit-codes.md",
      "title": "Exit codes",
      "urls": {
        "ai": "https://raw.githubusercontent.com/tooppoo/reportage/X.Y.Z/docs/reference/exit-codes.md",
        "human": "https://github.com/tooppoo/reportage/blob/X.Y.Z/docs/reference/exit-codes.md"
      }
    },
    {
      "id": "configuration",
      "path": "docs/reference/configuration.md",
      "title": "Configuration",
      "urls": {
        "ai": "https://raw.githubusercontent.com/tooppoo/reportage/X.Y.Z/docs/reference/configuration.md",
        "human": "https://github.com/tooppoo/reportage/blob/X.Y.Z/docs/reference/configuration.md"
      }
    },
    {
      "id": "artifacts",
      "path": "docs/reference/artifacts.md",
      "title": "Artifacts",
      "urls": {
        "ai": "https://raw.githubusercontent.com/tooppoo/reportage/X.Y.Z/docs/reference/artifacts.md",
        "human": "https://github.com/tooppoo/reportage/blob/X.Y.Z/docs/reference/artifacts.md"
      }
    },
    {
      "id": "json-report",
      "path": "spec/output/json-report/README.md",
      "title": "JSON execution report contract",
      "urls": {
        "ai": "https://raw.githubusercontent.com/tooppoo/reportage/X.Y.Z/spec/output/json-report/README.md",
        "human": "https://github.com/tooppoo/reportage/blob/X.Y.Z/spec/output/json-report/README.md"
      }
    },
    {
      "id": "run-result",
      "path": "spec/artifacts/run-result/README.md",
      "title": "Run result artifact contract",
      "urls": {
        "ai": "https://raw.githubusercontent.com/tooppoo/reportage/X.Y.Z/spec/artifacts/run-result/README.md",
        "human": "https://github.com/tooppoo/reportage/blob/X.Y.Z/spec/artifacts/run-result/README.md"
      }
    },
    {
      "id": "ai-generation-rules",
      "path": "docs/ai/generation-rules.md",
      "title": "AI generation rules",
      "urls": {
        "ai": "https://raw.githubusercontent.com/tooppoo/reportage/X.Y.Z/docs/ai/generation-rules.md",
        "human": "https://github.com/tooppoo/reportage/blob/X.Y.Z/docs/ai/generation-rules.md"
      }
    },
    {
      "id": "ai-validation-flow",
      "path": "docs/ai/validation-flow.md",
      "title": "AI validation flow",
      "urls": {
        "ai": "https://raw.githubusercontent.com/tooppoo/reportage/X.Y.Z/docs/ai/validation-flow.md",
        "human": "https://github.com/tooppoo/reportage/blob/X.Y.Z/docs/ai/validation-flow.md"
      }
    },
    {
      "id": "ai-common-mistakes",
      "path": "docs/ai/common-mistakes.md",
      "title": "AI common mistakes",
      "urls": {
        "ai": "https://raw.githubusercontent.com/tooppoo/reportage/X.Y.Z/docs/ai/common-mistakes.md",
        "human": "https://github.com/tooppoo/reportage/blob/X.Y.Z/docs/ai/common-mistakes.md"
      }
    }
  ],
  "schema_version": 1,
  "tool": {
    "name": "reportage",
    "tag": "X.Y.Z",
    "version": "X.Y.Z"
  },
  "validation": {
    "command": "reportage <file.repor> --format=json"
  }
}
